book,subject,object,sub_sentence,verb,sentence,sub_sent_score,verb_score,sent_score,sent_loc,sub_sent_vader,sent_vader,verb_vader,pair,title
sense_and_sensibility,Hermione,Hagrid,Hermione seized Hagrids binoculars,seized,"At these words , Hermione seized Hagrids binoculars , but instead of looking up at Harry , she started looking frantically at the crowd .",-0.39420562982559204,-0.48061877489089966,-0.9686149656772614,62709.0,0.0,-0.4767,0.0,"{'Hermione', 'Hagrid'}",Sense and Sensibility
sense_and_sensibility,Hermione,Hagrid,Hermione grabbed Hagrids arm,grabbed,They had just passed a bend in the path when Hermione grabbed Hagrids arm .,0.9872186183929443,0.9996112585067749,0.7192151546478271,84491.0,0.0,0.0,0.0,"{'Hermione', 'Hagrid'}",Sense and Sensibility
sense_and_sensibility,Hermione,Harry,Hermione ignored him and spoke to Harry,spoke,Hermione ignored him and spoke to Harry .,-0.5205338895320892,0.9959455728530884,-0.45461606979370117,51004.0,-0.3182,-0.3182,0.0,"{'Harry', 'Hermione'}",Sense and Sensibility
sense_and_sensibility,Hermione,Harry,Hermione was now refusing to speak to Harry and Ron,refusing,"Hermione was now refusing to speak to Harry and Ron , but she was such a bossy know - it - all that they saw this as an added bonus .",-0.9937695534899831,-0.8647245019674301,-0.49416977167129517,54040.0,-0.4019,0.5994,-0.4019,"{'Harry', 'Hermione'}",Sense and Sensibility
sense_and_sensibility,Hermione,Harry,Hermione was now refusing to speak to Harry and Ron,speak,"Hermione was now refusing to speak to Harry and Ron , but she was such a bossy know - it - all that they saw this as an added bonus .",-0.9937695534899831,0.9991379976272583,-0.49416977167129517,54040.0,-0.4019,0.5994,0.0,"{'Harry', 'Hermione'}",Sense and Sensibility
sense_and_sensibility,Hermione,Harry,"Hermione was stomping up the stairs , looking disapprovingly at the package in Harrys hand",looking,"Hermione was stomping up the stairs , looking disapprovingly at the package in Harrys hand .",-0.9795173592865467,0.9996346235275269,-0.9766026698052883,54735.0,0.4939,0.4939,0.0,"{'Harry', 'Hermione'}",Sense and Sensibility
sense_and_sensibility,Hermione,Harry,Hermione was checking Harry and Rons Charms homework,checking,Hermione was checking Harry and Rons Charms homework for them .,0.004628896713256836,0.999405026435852,0.05108940601348877,59987.0,0.4404,0.4404,0.0,"{'Harry', 'Hermione'}",Sense and Sensibility
sense_and_sensibility,Hermione,Harry,"Hermione , who had all her fingers crossed in her lap , was squinting fixedly at Harry , who was circling the game like a hawk , looking for the Snitch",squinting,"Hermione , who had all her fingers crossed in her lap , was squinting fixedly at Harry , who was circling the game like a hawk , looking for the Snitch .",0.830674409866333,-0.7236635982990265,0.8494782447814941,73508.0,0.3612,0.3612,0.0,"{'Harry', 'Hermione'}",Sense and Sensibility
sense_and_sensibility,Hermione,Harry,"Hermione had now started making study schedules for Harry and Ron , too",started,"Hermione had now started making study schedules for Harry and Ron , too .",-0.29687976837158203,0.9997689723968506,-0.33247172832489014,77267.0,0.0,0.0,0.0,"{'Harry', 'Hermione'}",Sense and Sensibility
sense_and_sensibility,Hermione,Harry,Hermione had now started making study schedules for Harry and Ron,making,"Hermione had now started making study schedules for Harry and Ron , too .",0.12502241134643555,0.9997513294219971,-0.33247172832489014,77267.0,0.0,0.0,0.0,"{'Harry', 'Hermione'}",Sense and Sensibility
sense_and_sensibility,Hermione,Harry,"You re right , Harry , said Hermione",said,"You re right , Harry , said Hermione in a small voice .",0.9993898868560791,0.9940192699432373,0.9990358352661133,89903.0,0.0,0.0,0.0,"{'Harry', 'Hermione'}",Sense and Sensibility
sense_and_sensibility,Hermione,Malfoy,"Malfoy tricked you , Hermione said",said,"Malfoy tricked you , Hermione said to Harry .",-0.9966076267883182,0.9940192699432373,-0.9911623997613788,52611.0,-0.1531,-0.1531,0.0,"{'Malfoy', 'Hermione'}",Sense and Sensibility
sense_and_sensibility,Hermione,Ron,Hermione was now refusing to speak to Harry and Ron,refusing,"Hermione was now refusing to speak to Harry and Ron , but she was such a bossy know - it - all that they saw this as an added bonus .",-0.9937695534899831,-0.8647245019674301,-0.49416977167129517,54040.0,-0.4019,0.5994,-0.4019,"{'Ron', 'Hermione'}",Sense and Sensibility
sense_and_sensibility,Hermione,Ron,Hermione was now refusing to speak to Harry and Ron,speak,"Hermione was now refusing to speak to Harry and Ron , but she was such a bossy know - it - all that they saw this as an added bonus .",-0.9937695534899831,0.9991379976272583,-0.49416977167129517,54040.0,-0.4019,0.5994,0.0,"{'Ron', 'Hermione'}",Sense and Sensibility
sense_and_sensibility,Hermione,Ron,Hermione was checking Harry and Rons Charms homework,checking,Hermione was checking Harry and Rons Charms homework for them .,0.004628896713256836,0.999405026435852,0.05108940601348877,59987.0,0.4404,0.4404,0.0,"{'Ron', 'Hermione'}",Sense and Sensibility
sense_and_sensibility,Hermione,Ron,"Hermione had now started making study schedules for Harry and Ron , too",started,"Hermione had now started making study schedules for Harry and Ron , too .",-0.29687976837158203,0.9997689723968506,-0.33247172832489014,77267.0,0.0,0.0,0.0,"{'Ron', 'Hermione'}",Sense and Sensibility
sense_and_sensibility,Hermione,Ron,Hermione had now started making study schedules for Harry and Ron,making,"Hermione had now started making study schedules for Harry and Ron , too .",0.12502241134643555,0.9997513294219971,-0.33247172832489014,77267.0,0.0,0.0,0.0,"{'Ron', 'Hermione'}",Sense and Sensibility
sense_and_sensibility,Hermione,Ron,Hermione was testing Ron,testing,"Harry went back to the library , where Hermione was testing Ron on Astronomy .",-0.5492396950721741,0.9986488819122314,-0.9004199430346489,81426.0,0.0,0.0,0.0,"{'Ron', 'Hermione'}",Sense and Sensibility
sense_and_sensibility,Hermione,Ron,"Harry and Hermione stayed quiet , watching Ron think",watching,"Harry and Hermione stayed quiet , watching Ron think .",-0.8615027368068695,0.9997916221618652,-0.8163318336009979,93762.0,0.0,0.0,0.0,"{'Ron', 'Hermione'}",Sense and Sensibility
sense_and_sensibility,Hermione,Uncle Vernon,"Hermione , looking uncertainly after Uncle Vernon",looking,"Hope you have - er - a good holiday , said Hermione , looking uncertainly after Uncle Vernon , shocked that anyone could be so unpleasant .",0.12833631038665771,0.9996346235275269,-0.1116301417350769,103086.0,-0.34,-0.0493,0.0,"{'Hermione', 'Uncle Vernon'}",Sense and Sensibility
sense_and_sensibility,Neville,Harry,Neville had been tugging on the sleeve of Harrys bathrobe,tugging,For Neville had been tugging on the sleeve of Harrys bathrobe for the last minute .,0.07465267181396484,0.9802333116531372,0.422932505607605,53153.0,0.0,0.0,0.0,"{'Harry', 'Neville'}",Sense and Sensibility
sense_and_sensibility,Neville,Malfoy,"Neville was trying to remember what he d forgotten when Draco Malfoy , who was passing the Gryffindor table , snatched the Remembrall out of his hand",trying,"Neville was trying to remember what he d forgotten when Draco Malfoy , who was passing the Gryffindor table , snatched the Remembrall out of his hand .",-0.8186982423067093,0.9991613626480103,-0.8203630149364471,47966.0,0.3182,0.3182,0.0,"{'Neville', 'Malfoy'}",Sense and Sensibility
sense_and_sensibility,Neville,Malfoy,"Neville was trying to remember what he d forgotten when Draco Malfoy , who was passing the Gryffindor table , snatched the Remembrall out of his hand",remember,"Neville was trying to remember what he d forgotten when Draco Malfoy , who was passing the Gryffindor table , snatched the Remembrall out of his hand .",-0.8186982423067093,0.999779462814331,-0.8203630149364471,47966.0,0.3182,0.3182,0.0,"{'Neville', 'Malfoy'}",Sense and Sensibility
sense_and_sensibility,Quirrell,Harry,"Quirrell said Snape - Professor Snape , Harry",said,"Quirrell said Snape - Professor Snape , Harry .",0.8490315675735474,0.9940192699432373,0.8163905143737793,99750.0,0.0,0.0,0.0,"{'Harry', 'Quirrell'}",Sense and Sensibility
sense_and_sensibility,Ron,Dumbledore,"Dumbledores off his rocker , all right , said Ron",said,"Yeah , Dumbledores off his rocker , all right , said Ron proudly .",-0.01311337947845459,0.9940192699432373,0.9597980976104736,100749.0,0.0,0.7003,0.0,"{'Ron', 'Dumbledore'}",Sense and Sensibility
sense_and_sensibility,Ron,Hagrid,Harry and Ron were delighted to hear Hagrid call Filch that old git,hear,Harry and Ron were delighted to hear Hagrid call Filch that old git .,0.8935146331787109,0.9997754096984863,0.9457333087921143,46742.0,0.5106,0.5106,0.0,"{'Ron', 'Hagrid'}",Sense and Sensibility
sense_and_sensibility,Ron,Harry,Ron whispered to Harry,whispered,Ron whispered to Harry .,0.9725805521011353,-0.9223304986953735,0.9052278995513916,39436.0,0.0,0.0,0.0,"{'Ron', 'Harry'}",Sense and Sensibility
sense_and_sensibility,Ron,Harry,"Thomas , Dean , a Black boy even taller than Ron , joined Harry",joined,"Thomas , Dean , a Black boy even taller than Ron , joined Harry at the Gryffindor table .",0.9898016452789307,0.9997825622558594,0.980492353439331,40694.0,0.0,0.0,0.0,"{'Ron', 'Harry'}",Sense and Sensibility
sense_and_sensibility,Ron,Harry,Ron grinned at Harry,grinned,Ron grinned at Harry .,0.9995256662368774,0.9993581771850586,0.9993462562561035,54454.0,0.2732,0.2732,0.2732,"{'Ron', 'Harry'}",Sense and Sensibility
sense_and_sensibility,Ron,Harry,"Ron , pulling Harry",pulling,"hissed Ron , pulling Harry behind a large stone griffin .",0.989585280418396,0.9991072416305542,-0.9758345223963261,57423.0,0.0,0.0,0.0,"{'Ron', 'Harry'}",Sense and Sensibility
sense_and_sensibility,Ron,Harry,Ron also started teaching Harry wizard chess,started,Ron also started teaching Harry wizard chess .,0.9982229471206665,0.9997689723968506,0.9976474046707153,65560.0,0.0,0.0,0.0,"{'Ron', 'Harry'}",Sense and Sensibility
sense_and_sensibility,Ron,Harry,Ron also started teaching Harry wizard chess,teaching,Ron also started teaching Harry wizard chess .,0.9982229471206665,0.9997632503509521,0.9976474046707153,65560.0,0.0,0.0,0.0,"{'Ron', 'Harry'}",Sense and Sensibility
sense_and_sensibility,Ron,Harry,Ron tore his eyes away from this splendid sight to look excitedly at Harry,look,Ron tore his eyes away from this splendid sight to look excitedly at Harry .,0.9997060298919678,0.9997045993804932,0.9996888637542725,69711.0,0.8316,0.8316,0.0,"{'Ron', 'Harry'}",Sense and Sensibility
sense_and_sensibility,Ron,Harry,Ron pulled Harry,pulled,And Ron pulled Harry out of the room .,0.9769564867019653,0.9916491508483887,-0.9372381716966629,69911.0,0.0,0.0,0.0,"{'Ron', 'Harry'}",Sense and Sensibility
sense_and_sensibility,Ron,Harry,"Ron , thumping Harry",thumping,"shouted Ron , thumping Harry on the back .",0.9955981969833374,-0.39464324712753296,0.9672892093658447,74874.0,0.0,0.0,0.0,"{'Ron', 'Harry'}",Sense and Sensibility
sense_and_sensibility,Ron,Harry,Ron warned Harry,warned,"Keep playing , Ron warned Harry as they slipped out of the cloak and crept toward the trapdoor .",-0.9185098260641098,-0.999431784322951,0.9496520757675171,91597.0,-0.2732,-0.0772,-0.2732,"{'Ron', 'Harry'}",Sense and Sensibility
sense_and_sensibility,Ron,Harry,Ron went speeding in the direction that Harry was pointing,went,"Ron went speeding in the direction that Harry was pointing , crashed into the ceiling , and nearly fell off his broom .",0.99256432056427,0.9995723962783813,-0.9547269158065319,93263.0,0.0,0.0,0.0,"{'Ron', 'Harry'}",Sense and Sensibility
sense_and_sensibility,Ron,Harry,Ron only just noticed in time that Harry and Hermione were in danger,only,"Twice , Ron only just noticed in time that Harry and Hermione were in danger .",-0.6651838719844818,-0.8605104684829712,-0.8035278916358948,94080.0,-0.5267,-0.5267,0.0,"{'Ron', 'Harry'}",Sense and Sensibility
sense_and_sensibility,Ron,Hermione,Ron looked at his watch and then glared furiously at Hermione and Neville,glared,Ron looked at his watch and then glared furiously at Hermione and Neville .,-0.9911569692194462,-0.9993913904763758,-0.9848538907244802,52006.0,-0.4404,-0.4404,0.0,"{'Ron', 'Hermione'}",Sense and Sensibility
sense_and_sensibility,Ron,Hermione,Harry and Ron overheard Parvati Patil telling her friend Lavender that Hermione was crying in the girls bathroom and wanted to be left alone,overheard,"On their way down to the Great Hall for the Halloween feast , Harry and Ron overheard Parvati Patil telling her friend Lavender that Hermione was crying in the girls bathroom and wanted to be left alone .",-0.8819440826773643,-0.9992398484027945,-0.764204204082489,56958.0,-0.2263,0.4939,0.0,"{'Ron', 'Hermione'}",Sense and Sensibility
sense_and_sensibility,Ron,Hermione,"Honestly , Hermione , you think all teachers are saints or something , snapped Ron",snapped,"Honestly , Hermione , you think all teachers are saints or something , snapped Ron .",-0.7256560027599335,0.1328204870223999,-0.7642239034175873,60443.0,0.4588,0.4588,0.0,"{'Ron', 'Hermione'}",Sense and Sensibility
sense_and_sensibility,Ron,Hermione,Harry and Ron beamed at Hermione,beamed,Harry and Ron beamed at Hermione .,0.9996525049209595,0.9997148513793945,0.9996448755264282,76540.0,0.0,0.0,0.0,"{'Ron', 'Hermione'}",Sense and Sensibility
sense_and_sensibility,Ron,Hermione,Ron only just noticed in time that Harry and Hermione were in danger,only,"Twice , Ron only just noticed in time that Harry and Hermione were in danger .",-0.6651838719844818,-0.8605104684829712,-0.8035278916358948,94080.0,-0.5267,-0.5267,0.0,"{'Ron', 'Hermione'}",Sense and Sensibility
sense_and_sensibility,Ron,Malfoy,"Harry and Ron headed upstairs , smothering their laughter at Malfoys obvious rage and confusion",smothering,"Harry and Ron headed upstairs , smothering their laughter at Malfoys obvious rage and confusion .",-0.39033693075180054,-0.9672462418675423,-0.38579320907592773,54647.0,-0.6124,-0.6124,-0.34,"{'Ron', 'Malfoy'}",Sense and Sensibility
sense_and_sensibility,Uncle Vernon,Harry,"Harry he would nt stay in the same room , while Aunt Petunia and Uncle Vernon did nt shut",shut,"True , Dudley was now so scared of Harry he would nt stay in the same room , while Aunt Petunia and Uncle Vernon did nt shut Harry in his cupboard , force him to do anything , or shout at him - in fact , they did nt speak to him at all .",-0.95785828307271,-0.9995021139620803,-0.9792077373713255,29259.0,0.0,-0.2362,0.0,"{'Harry', 'Uncle Vernon'}",Sense and Sensibility
sense_and_sensibility,Uncle Vernon,Harry,Uncle Vernon dumped Harrys trunk,dumped,Uncle Vernon dumped Harrys trunk onto a cart and wheeled it into the station for him .,-0.9966686994303018,-0.9994848375790752,-0.8878661468625069,30016.0,-0.4019,-0.4019,-0.4019,"{'Harry', 'Uncle Vernon'}",Sense and Sensibility
sense_and_sensibility,Uncle Vernon,Harry,"Uncle Vernon , still purple - faced , still mustached , still looking furious at the nerve of Harry",looking,"It was Uncle Vernon , still purple - faced , still mustached , still looking furious at the nerve of Harry , carrying an owl in a cage in a station full of ordinary people .",-0.36012595891952515,0.9996346235275269,-0.1919407844543457,102965.0,-0.5719,-0.5719,0.0,"{'Harry', 'Uncle Vernon'}",Sense and Sensibility
winnie_the_pooh,Christopher Robin,Kanga,Christopher Robin had thought of something else to do with Kanga,thought,"Pooh was very excited when he heard this , and suggested that they should have an Expotition to discover the East Pole , but Christopher Robin had thought of something else to do with Kanga ;",-0.9794895369559526,0.9996993541717529,-0.24670177698135376,26620.0,0.0,0.2135,0.0,"{'Kanga', 'Christopher Robin'}",Winnie the Pooh
winnie_the_pooh,Christopher Robin,Piglet,"IN WHICH PIGLET MEETS A HEFFALUMP One day , when Christopher Robin and Winnie - the - Pooh and Piglet were all talking together , Christopher Robin finished the mouthful he was eating and said carelessly : I saw a Heffalump to - day , Piglet",IN WHICH PIGLET MEETS A HEFFALUMP,"CHAPTER V IN WHICH PIGLET MEETS A HEFFALUMP One day , when Christopher Robin and Winnie - the - Pooh and Piglet were all talking together , Christopher Robin finished the mouthful he was eating and said carelessly : I saw a Heffalump to - day , Piglet .",-0.39244014024734497,0.8529535531997681,-0.21530205011367798,9230.0,-0.25,-0.25,0.0,"{'Christopher Robin', 'Piglet'}",Winnie the Pooh
winnie_the_pooh,Christopher Robin,Pooh,"Christopher Robin gave a deep sigh , picked his Bear up by the leg , and walked off to the door , trailing Pooh",trailing,"Christopher Robin gave a deep sigh , picked his Bear up by the leg , and walked off to the door , trailing Pooh behind him .",-0.9915639301761985,-0.9974745693616569,-0.9916054271161556,3055.0,0.0258,0.0258,0.0,"{'Christopher Robin', 'Pooh'}",Winnie the Pooh
winnie_the_pooh,Christopher Robin,Pooh,Christopher Robin read that sort of book at the North end of Pooh,read,"So for a week Christopher Robin read that sort of book at the North end of Pooh , and Rabbit hung his washing on the South end .",-0.8498409539461136,0.9979761838912964,-0.9821874052286148,5194.0,0.0,0.0,0.0,"{'Christopher Robin', 'Pooh'}",Winnie the Pooh
winnie_the_pooh,Christopher Robin,Pooh,"Christopher Robin said , In the Usual Way , if you know what I mean , Pooh , and Pooh , who did nt",said,"Christopher Robin said , In the Usual Way , if you know what I mean , Pooh , and Pooh , who did nt , said Oh !",-0.13869822025299072,0.9940192699432373,0.885056734085083,16968.0,0.0,0.0,0.0,"{'Christopher Robin', 'Pooh'}",Winnie the Pooh
winnie_the_pooh,Christopher Robin,Pooh,"Poohs found the North Pole , said Christopher Robin",said,"Poohs found the North Pole , said Christopher Robin .",0.9958938360214233,0.9940192699432373,0.9966170787811279,25357.0,0.0,0.0,0.0,"{'Christopher Robin', 'Pooh'}",Winnie the Pooh
winnie_the_pooh,Christopher Robin,Pooh,Christopher Robin had told them about _ The Floating Bear _ and the _ Brain of Pooh _ and all the wonderful ships he had invented and sailed on,told,"And he began to wonder if all the other animals would know that it was a special Pooh Party , and if Christopher Robin had told them about _ The Floating Bear _ and the _ Brain of Pooh _ and all the wonderful ships he had invented and sailed on , and he began to think how awful it would be if everybody had forgotten about it , and nobody quite knew what the party was for ;",0.9996381998062134,-0.13295918703079224,-0.868789553642273,29533.0,0.5719,0.7845,0.0,"{'Christopher Robin', 'Pooh'}",Winnie the Pooh
winnie_the_pooh,Piglet,Kanga,said Piglet to Kanga,said,said Piglet to Kanga .,0.895388126373291,0.9940192699432373,0.5621448755264282,23080.0,0.0,0.0,0.0,"{'Kanga', 'Piglet'}",Winnie the Pooh
winnie_the_pooh,Piglet,Pooh,"Piglet said , If you see what I mean , Pooh",said,"but when they came to the stream and had helped each other across the stepping stones , and were able to walk side by side again over the heather , they began to talk in a friendly way about this and that , and Piglet said , If you see what I mean , Pooh , and Pooh said , Its just what I think myself , Piglet , and Piglet said , But , on the other hand , Pooh , we must remember , and Pooh said , Quite true , Piglet , although I had forgotten it for the moment .",0.9739241600036621,0.9940192699432373,0.9867286682128906,9444.0,0.0,0.9079,0.0,"{'Pooh', 'Piglet'}",Winnie the Pooh
winnie_the_pooh,Piglet,Pooh,"Piglet remembered that , if they put acorns in the Trap , _ he _ would have to find the acorns , but if they put honey , then Pooh would have to give up some of his own honey",remembered,"and they were just going to argue about it , when Piglet remembered that , if they put acorns in the Trap , _ he _ would have to find the acorns , but if they put honey , then Pooh would have to give up some of his own honey , so he said , All right , honey then , just as Pooh remembered it too , and was going to say , All right , haycorns .",-0.5534846484661102,0.9997444152832031,-0.6417577862739563,10524.0,-0.1655,-0.3291,0.0,"{'Pooh', 'Piglet'}",Winnie the Pooh
winnie_the_pooh,Piglet,Pooh,"Pooh , said Piglet",said,"Well , good night , Pooh , said Piglet , when they had got to Poohs house .",-0.9957871441729367,0.9940192699432373,0.9718319177627563,11010.0,0.0,0.6124,0.0,"{'Pooh', 'Piglet'}",Winnie the Pooh
winnie_the_pooh,Piglet,Pooh,Piglet whispered to Pooh,whispered,Piglet whispered to Pooh .,0.9911400079727173,-0.9223304986953735,0.9853074550628662,30944.0,0.0,0.0,0.0,"{'Pooh', 'Piglet'}",Winnie the Pooh
winnie_the_pooh,Pooh,Christopher Robin,"Pooh thought how nice it would be if they met Christopher Robin suddenly but quite accidentally , and only because he liked Christopher Robin so much",thought,"were there , instead of elsewhere , and Pooh thought how nice it would be if they met Christopher Robin suddenly but quite accidentally , and only because he liked Christopher Robin so much .",0.9962356090545654,0.9996993541717529,0.9829792976379395,6459.0,0.2641,0.2641,0.0,"{'Christopher Robin', 'Pooh'}",Winnie the Pooh
winnie_the_pooh,Pooh,Christopher Robin,"Pooh sat down , dug his feet into the ground , and pushed hard against Christopher Robins back",pushed,"Pooh sat down , dug his feet into the ground , and pushed hard against Christopher Robins back , and Christopher Robin pushed hard against his , and pulled and pulled at his boot until he had got it on .",-0.9200073778629303,-0.9565285928547382,-0.5891582369804382,21680.0,-0.1027,-0.2023,0.0,"{'Christopher Robin', 'Pooh'}",Winnie the Pooh
winnie_the_pooh,Pooh,Christopher Robin,Pooh looked anxiously at Christopher Robin,looked,Pooh looked anxiously at Christopher Robin .,0.9972379207611084,0.9936122894287109,0.9970308542251587,25349.0,-0.2263,-0.2263,0.0,"{'Christopher Robin', 'Pooh'}",Winnie the Pooh
winnie_the_pooh,Pooh,Christopher Robin,"Pooh himself-- said something so clever that Christopher Robin could only look at him with mouth open and eyes staring , wondering if this was really the Bear of Very Little Brain whom he had known and loved so long",said,"- Eeyores Comforter and Tail - finder--- in fact , Pooh himself-- said something so clever that Christopher Robin could only look at him with mouth open and eyes staring , wondering if this was really the Bear of Very Little Brain whom he had known and loved so long .",0.9991053342819214,0.9940192699432373,0.9988998174667358,28561.0,0.8301,0.8926,0.0,"{'Christopher Robin', 'Pooh'}",Winnie the Pooh
winnie_the_pooh,Pooh,Piglet,"said , If you see what I mean , Pooh , and Pooh said , Its just what I think myself , Piglet",said,"but when they came to the stream and had helped each other across the stepping stones , and were able to walk side by side again over the heather , they began to talk in a friendly way about this and that , and Piglet said , If you see what I mean , Pooh , and Pooh said , Its just what I think myself , Piglet , and Piglet said , But , on the other hand , Pooh , we must remember , and Pooh said , Quite true , Piglet , although I had forgotten it for the moment .",0.9491840600967407,0.9940192699432373,0.9867286682128906,9444.0,0.0,0.9079,0.0,"{'Pooh', 'Piglet'}",Winnie the Pooh
winnie_the_pooh,Pooh,Piglet,"said , If you see what I mean , Pooh , and Pooh said , Its just what I think myself , Piglet , and Piglet said , But , on the other hand , Pooh , we must remember , and Pooh said , Quite true , Piglet",said,"but when they came to the stream and had helped each other across the stepping stones , and were able to walk side by side again over the heather , they began to talk in a friendly way about this and that , and Piglet said , If you see what I mean , Pooh , and Pooh said , Its just what I think myself , Piglet , and Piglet said , But , on the other hand , Pooh , we must remember , and Pooh said , Quite true , Piglet , although I had forgotten it for the moment .",0.9634133577346802,0.9940192699432373,0.9867286682128906,9444.0,0.8569,0.9079,0.0,"{'Pooh', 'Piglet'}",Winnie the Pooh
winnie_the_pooh,Pooh,Piglet,"Pooh looked round to see that nobody else was listening , and said in a very solemn voice : Piglet , I have decided something",said,"And then , just as they came to the Six Pine Trees , Pooh looked round to see that nobody else was listening , and said in a very solemn voice : Piglet , I have decided something .",0.2180178165435791,0.9940192699432373,0.05111074447631836,9557.0,-0.1513,-0.1513,0.0,"{'Pooh', 'Piglet'}",Winnie the Pooh
winnie_the_pooh,Pooh,Piglet,"Hallo , Pooh , said Piglet",said,"Hallo , Pooh , said Piglet .",0.8710592985153198,0.9940192699432373,0.872355580329895,13931.0,0.0,0.0,0.0,"{'Pooh', 'Piglet'}",Winnie the Pooh
winnie_the_pooh,Pooh,Rabbit,Pooh rubbed his nose and said that he thought Rabbit had been talking about his family,said,Pooh rubbed his nose and said that he thought Rabbit had been talking about his family .,-0.7075229585170746,0.9940192699432373,-0.6953089535236359,17371.0,0.0,0.0,0.0,"{'Pooh', 'Rabbit'}",Winnie the Pooh
winnie_the_pooh,Rabbit,Piglet,"Piglet , said Rabbit",said,"Piglet , said Rabbit , taking out a pencil , and licking the end of it , you have nt any pluck .",-0.38607561588287354,0.9940192699432373,-0.999471484508831,17808.0,0.0,0.0,0.0,"{'Piglet', 'Rabbit'}",Winnie the Pooh
